{
  "evidence_id": "E-0374",
  "lead_id": "LH-0029",
  "kind": "operational",
  "found_at": "2026-08-27T08:31:21.865629+00:00",
  "source_url": "",
  "summary": "English academy with online course platform (LMS) — courses priced BDT 12,000-15,000 with visible enrollment",
  "confidence": 75,
  "raw": ""
}
