{
  "evidence_id": "E-0255",
  "lead_id": "LH-0027",
  "kind": "operational",
  "found_at": "2026-08-27T08:15:17.908013+00:00",
  "source_url": "",
  "summary": "700+ IELTS and 650+ PTE success stories used in marketing but no automated lead nurturing from success stories",
  "confidence": 75,
  "raw": ""
}
