{
  "evidence_id": "E-0304",
  "lead_id": "LH-0024",
  "kind": "operational",
  "found_at": "2026-08-27T08:25:42.607999+00:00",
  "source_url": "",
  "summary": "Leading packaging manufacturer (since 1996) but quote requests still depend on phone (01568316131) and email (sales@jobaidapack.com) — the 'Get a Quote' page doesn't auto-qualify or respond",
  "confidence": 75,
  "raw": ""
}
