{
  "evidence_id": "E-0258",
  "lead_id": "LH-0028",
  "kind": "operational",
  "found_at": "2026-08-27T08:15:18.184469+00:00",
  "source_url": "",
  "summary": "Quote request form on site but no instant response — corporate clients expect same-day acknowledgement",
  "confidence": 75,
  "raw": ""
}
