{
  "evidence_id": "E-0137",
  "lead_id": "LH-0016",
  "kind": "operational",
  "found_at": "2026-08-27T02:47:55.463257+00:00",
  "source_url": "",
  "summary": "Booking is phone/WhatsApp only (+8801975556633) — no online booking system or package comparison tool",
  "confidence": 75,
  "raw": ""
}
