{
  "evidence_id": "E-0290",
  "lead_id": "LH-0006",
  "kind": "operational",
  "found_at": "2026-08-27T08:25:41.562123+00:00",
  "source_url": "",
  "summary": "Property portal connects buyers/sellers but relies on a single WhatsApp line (+8801896280607) and phone for every enquiry — no automated buyer qualification or instant response",
  "confidence": 75,
  "raw": ""
}
