{
  "evidence_id": "E-0324",
  "lead_id": "LH-0027",
  "kind": "operational",
  "found_at": "2026-08-27T08:28:22.284687+00:00",
  "source_url": "",
  "summary": "British Council & Pearson certified institute with 5000+ students — high enquiry volume across 3 centers (Dhanmondi, Banani, Chattogram)",
  "confidence": 75,
  "raw": ""
}
