{
  "evidence_id": "E-0333",
  "lead_id": "LH-0028",
  "kind": "operational",
  "found_at": "2026-08-27T08:28:22.793953+00:00",
  "source_url": "",
  "summary": "AV production, LED walls, staging — complex multi-vendor coordination with no visible project management automation",
  "confidence": 75,
  "raw": ""
}
