{
  "evidence_id": "E-0369",
  "lead_id": "LH-0021",
  "kind": "operational",
  "found_at": "2026-08-27T08:31:21.477416+00:00",
  "source_url": "",
  "summary": "Event management + wedding planning, 800+ events since 2016 — weddings (Gaye Holud, Nikah, Reception, Walima) + corporate events",
  "confidence": 75,
  "raw": ""
}
